{
  "schemaVersion": 1,
  "kind": "reviewer-blinded-fixture-projection",
  "fixtureId": "synthetic-verifier-acq",
  "role": "verifier",
  "binding": {
    "prId": 4242,
    "repositoryId": "11111111-2222-3333-4444-555555555555",
    "project": "Widgets",
    "sourceCommit": "a1b2c3d4e5f6a7b8c9d0a1b2c3d4e5f6a7b8c9d0",
    "targetCommit": "f0e1d2c3b4a5f6e7d8c9b0a1f2e3d4c5b6a7f8e9",
    "changeSetDigest": "0bb7ae300b9336e3145432279dc9d54a2d7300e4ea0c6878745d25e69bd9d7c9"
  },
  "verifier": {
    "targetCommit": "f0e1d2c3b4a5f6e7d8c9b0a1f2e3d4c5b6a7f8e9",
    "changeSetDigest": "0bb7ae300b9336e3145432279dc9d54a2d7300e4ea0c6878745d25e69bd9d7c9",
    "configSha256": "2222222222222222222222222222222222222222222222222222222222222222",
    "scriptSha256": "3333333333333333333333333333333333333333333333333333333333333333",
    "promptSha256": "4444444444444444444444444444444444444444444444444444444444444444"
  }
}
